<?xml version="1.0" encoding="UTF-8"?>
<xs:schema xmlns:xs="http://www.w3.org/2001/XMLSchema" elementFormDefault="qualified">

    <xs:element name="nombre" type="xs:string" />
    <xs:element name="apellidos" type="xs:string" />
    <xs:element name="nota" type="xs:double" />

    <xs:attribute name="dni" type="xs:string" />

        <xs:element name="nota">
        <xs:simpleType>
                <xs:restriction base="xs:decimal">
                        <xs:minInclusive value="0" />
                        <xs:maxInclusive value="10" />
                        <xs:fractionDigits value="2"/>
                </xs:restriction>
        </xs:simpleType>
    </xs:element> 

    <xs:element name="alumno">
        <xs:complexType>
            <xs:sequence>
                <xs:element ref="nombre"/>
                <xs:element ref="apellidos"/>
                <xs:element ref="nota"/>
            </xs:sequence>
            <xs:attribute ref="dni"/>
        </xs:complexType>
    </xs:element>

    <xs:element name="datos">
        <xs:complexType>
            <xs:sequence>
                <xs:element ref="alumno" maxOccurs="unbounded"/>
            </xs:sequence>
        </xs:complexType>
    </xs:element>

</xs:schema>    
